{
  "format": "osd.custody/1",
  "record_id": "opm/norne",
  "path": "norne/NORNE_ATW2013.DATA",
  "origin_href": "https://raw.githubusercontent.com/OPM/opm-data/master/norne/NORNE_ATW2013.DATA",
  "key": "mirror/opm/norne/f346c910f68a80b41ee54606bd434dc9e2993fffa7a2469235f396c2c0a9e080/NORNE_ATW2013.DATA",
  "href": "https://mirror.example/mirror/opm/norne/f346c910f68a80b41ee54606bd434dc9e2993fffa7a2469235f396c2c0a9e080/NORNE_ATW2013.DATA",
  "sha256": "f346c910f68a80b41ee54606bd434dc9e2993fffa7a2469235f396c2c0a9e080",
  "bytes": 12129,
  "copied_at": "2026-10-23T12:00:00Z",
  "verifier_run": {
    "checked_at": "2026-10-23T09:12:40+00:00",
    "tool_version": "0.1.0"
  },
  "licence": {
    "name": "Open Database License 1.0 (decks); Database Contents License 1.0 (data)",
    "spdx": "ODbL-1.0",
    "url": "https://opendatacommons.org/licenses/odbl/1-0/",
    "redistribution": "allowed",
    "attribution": "required",
    "share_alike": true
  },
  "licence_text_sha256": null,
  "attribution": [
    "## Norne field simulation case (OPM data)",
    "",
    "- Record: opm/norne (collection opm--norne)",
    "- Origin: https://github.com/OPM/opm-data",
    "- Licence: Open Database License 1.0 (decks); Database Contents License 1.0 (data) (ODbL-1.0), https://opendatacommons.org/licenses/odbl/1-0/",
    "- Attribution: required",
    "- Redistribution: allowed",
    "- Share-alike: derived work must carry ODbL-1.0",
    "- Statement: none stated by the publisher in the record",
    "- Known issue: README adds: git history contains proprietary decks (now removed) where usage restrictions may apply.",
    "- Known issue: NTNU's own Norne hosting is no longer the source; OPM is the live home (search result, not opened on the NTNU side).",
    "- Known issue: share_alike is set for the ODbL share-alike clause, not a BY-SA family licence."
  ],
  "takedown": "https://github.com/ophiolite-labs/open-subsurface-data/issues/new?template=takedown.yml",
  "removal": {
    "state": "held"
  }
}
